<?xml version="1.0" encoding="UTF-8"?>
<!DOCTYPE data-capture-requirements SYSTEM "datacapture6.0.dtd">
<!-- Note that the dtd-system-identifier may be changed to point to the correct 
	location of pr.dtd if DTD validation is needed. -->
<data-capture-requirements
	dtd-system-identifier="http://localhost/iw/
pr.dtd" name="press-release">
	<ruleset name="dct">
		<root-container name="press-release" location="press-release">
			<container location="head" name="head">
				<label>Heading</label>
				<item name="title" pathid="title">
					<label>Title</label>
					<description>
						This is the title of the press release.
						Make it hook people in!
					</description>
					<text maxlength="0" required="t" size="40" />
				</item>
				<container location="byline" name="byline">
					<label>Byline</label>
					<item name="author" pathid="@author">
						<label>Author</label>
						<description>Your name here, please.</description>
						<text maxlength="0" required="t" size="20" />
					</item>
					<item name="location" pathid="@location">
						<label>Location</label>
						<description>Select the appropriate office.</description>
						<radio>
							<option label="Sunnyvale, CA" value="CA" selected="t" />
							<option label="Bethesda, MD" value="MD" />
							<option label="Chicago, IL" value="IL" />
						</radio>
					</item>
				</container>
			</container>
			<container name="body" location="body">
				<label>Body</label>
				<container combination="and" location="" max="20" min="1"
					name="IWSubElements">
					<container combination="and" location="section" name="section">
						<label>Section</label>
						<item name="subheading" pathid="subheading">
							<label>Subheading</label>
							<description>
								This is just a section subheading.
							</description>
							<text maxlength="0" required="t" size="40" />
						</item>
						<item max="20" min="0" name="paragraph" pathid="paragraph">
							<label>Paragraph</label>
							<description>
								Be frugal with words -- make every word count!
								Do not forget: Build The Buzz!
							</description>
							<textarea cols="75" external-editor="visualformat"
								external-editor-inline="t" required="t" rows="10" wrap="off" />
						</item>
					</container>
				</container>
			</container>
		</root-container>
	</ruleset>
</data-capture-requirements>